### ISSUE TITLE
Dropping over-large ethernet frame

### ISSUE THREAD

**Issue by jiscfoo** [docker/for-mac#3568]
See also #1577

I'm trying to use a RADIUS client from within a Docker container. Part of the return UDP traffic is a large packet which is not getting into the container:

```
2019-03-06 11:37:34.327281+0000  localhost com.docker.vpnkit[35111]: Connected Ethernet interface f6:16:36:bc:f9:c6
2019-03-06 11:37:34.327381+0000  localhost com.docker.vpnkit[35111]: UDP interface connected on x.x.x.x
2019-03-06 11:37:34.341313+0000  localhost com.docker.vpnkit[35111]: Vmnet.Server Dropping over-large ethernet frame, length = 1532, mtu = 1500
```

  - [x] I have tried with the latest version of my channel (Stable ~or Edge~)
  - [x] I have uploaded Diagnostics
  - Diagnostics ID: D38C123A-BC95-4914-8892-2DCF8DEB18AC/20190306114746

### Expected behavior

UDP packet arrives in container, RADIUS conversation continues

### Actual behavior

UDP packet does not arrive in container, RADIUS times out (verified using tcpdump within container and in host):

#### Inside container
```
# rad_eap_test -m WPA-EAP -e PEAP -H x.x.x.x -P 21812 -S secret -u user -A anonymoususer -p 'password'
11:45:28.821469 IP d2514ca3d53e.55604 > fiesta.lan.21812: RADIUS, Access-Request (1), id: 0x00 length: 181
11:45:28.825170 IP fiesta.lan.21812 > d2514ca3d53e.55604: RADIUS, Access-Challenge (11), id: 0x00 length: 90
11:45:28.825985 IP d2514ca3d53e.55604 > fiesta.lan.21812: RADIUS, Access-Request (1), id: 0x01 length: 382
11:45:31.794799 IP d2514ca3d53e.55604 > fiesta.lan.21812: RADIUS, Access-Request (1), id: 0x01 length: 382
timeout; 5
```

#### Host layer
```
# tcpdump -T radius -k -i any port 21812
11:45:28.788598 (lo0, proc com.docker.vpnk:35111, svc BE, out, so) IP fiesta.lan.61011 > fiesta.lan.21812: RADIUS, Access-Request (1), id: 0x00 length: 181
11:45:28.788610 (lo0, proc VBoxNetNAT:74969, svc BE, in, so) IP fiesta.lan.61011 > fiesta.lan.21812: RADIUS, Access-Request (1), id: 0x00 length: 181
11:45:28.791131 (lo0, proc VBoxNetNAT:74969, svc BE, out, so) IP fiesta.lan.21812 > fiesta.lan.61011: RADIUS, Access-Challenge (11), id: 0x00 length: 90
11:45:28.791147 (lo0, proc com.docker.vpnk:35111, svc BE, in, so) IP fiesta.lan.21812 > fiesta.lan.61011: RADIUS, Access-Challenge (11), id: 0x00 length: 90
11:45:28.792480 (lo0, proc com.docker.vpnk:35111, svc BE, out, so) IP fiesta.lan.61011 > fiesta.lan.21812: RADIUS, Access-Request (1), id: 0x01 length: 382
11:45:28.792495 (lo0, proc VBoxNetNAT:74969, svc BE, in, so) IP fiesta.lan.61011 > fiesta.lan.21812: RADIUS, Access-Request (1), id: 0x01 length: 382
11:45:28.795157 (lo0, proc VBoxNetNAT:74969, svc BE, out, so) IP fiesta.lan.21812 > fiesta.lan.61011: RADIUS, Access-Challenge (11), id: 0x01 length: 1490
11:45:28.795173 (lo0, proc com.docker.vpnk:35111, svc BE, in, so) IP fiesta.lan.21812 > fiesta.lan.61011: RADIUS, Access-Challenge (11), id: 0x01 length: 1490
11:45:31.792441 (lo0, proc com.docker.vpnk:35111, svc BE, out, so) IP fiesta.lan.61011 > fiesta.lan.21812: RADIUS, Access-Request (1), id: 0x01 length: 382
11:45:31.792456 (lo0, proc VBoxNetNAT:74969, svc BE, in, so) IP fiesta.lan.61011 > fiesta.lan.21812: RADIUS, Access-Request (1), id: 0x01 length: 382
11:45:31.793650 (lo0, proc VBoxNetNAT:74969, svc BE, out, so) IP fiesta.lan.21812 > fiesta.lan.61011: RADIUS, Access-Challenge (11), id: 0x01 length: 1490
11:45:31.793668 (lo0, proc com.docker.vpnk:35111, svc BE, in, so) IP fiesta.lan.21812 > fiesta.lan.61011: RADIUS, Access-Challenge (11), id: 0x01 length: 1490
```

### Information
Please, help us understand the problem.  For instance:
  - Is it reproducible? Yes
  - Is the problem new? No
  - Did the problem appear with an update? Don't know
  - A reproducible case if this is a bug, Dockerfile attached but need a RADIUS server doing PEAP to reproduce
  - macOS Version: 10.14.3

### Diagnostic logs
Uploaded

### Steps to reproduce the behavior

See: https://github.com/jiscfoo/docker-rad_eap_test

### Further information

I've tried using the same Docker image from a Linux host and it seems to work
